title,cluster,description,keywords
Unincorporated LA County Road Closures,2,"This service shows real time information of road closures in the unincorporated areas of Los Angeles County ONLY. 
Note: Estimated road opening dates are subject to change without notice. Please check this site periodically before finalizing any travel plans.

https://egis3.lacounty.gov/arcgis/rest/services/DPW/Road_Closures/MapServer/0","plans, used, areas, zones, santa, airport"
LA SHERIFF CRIMES FROM 2004 TO 2014,3,Crimes reported between 2004 and 2014,"crimes, crimes, report, cities, case, postal"
Open Data Finance Glossary,4,Open Data Finance Glossary,"data, la, la, year, unincorporated, areas"
Parcels 2014 Tax Roll,7,Parcel shapes from the 2014 Assessor Tax Roll,"parcels, assessor, rolls, assessorid, property, shape"
LA County Finance - Open Expenditures,11,"This dataset includes list the County’s expenditures which allows the citizens to see the amount spent and the category by County fund and County department.  It reflects the County’s spending information at a Fund Group, Function, Department, Budget Unit, Expenditure Category, and Expenditure Class level.","budget, funds, dataset, department, category, department"
ZIP Codes and Postal Cities,3,"Many users confuse the name the Post Office delivers main to (e.g. Van Nuys, Hollywood) as a legal city (in this case Los Angeles), when they are a postal city. The County contains 88 legal cities, and over 400 postal names that are tied to the ZIPCodes. To support useability and geocoding, we have attached the first 3 postal cities to each address, based upon its ZIPCode.

This dataset is compiled from the US Postal Service website, usps.copm","crimes, crimes, report, cities, case, postal"
Business License Referrals,4,"This layer/table was created to track the more than 600 Business License checks, and nearly 75 DMV referrals, that the LA County Department of Regional Planning's Land Development Coordinating Center (LDCC) processes on an annual basis. As of July 2014, over 20,000 referrals had been processed since the 1970’s. The intent of a referral is to confirm the consistency of a proposed business with a parcel’s zoning.","data, la, la, year, unincorporated, areas"
Subdivision Activity (Unincorporated Areas),8,"This table (Subdivision Activity) represents land subdivisions in the unincorporated area that are recorded, approved, or pending in the subdivision process.   These are Tract Maps (TR) and Parcel Maps (PM).","subdivision, statistics, record, approved, proposed, maps"
Planning Permits and Case Information for Unincorporated Areas,3,"This layer shows the spatial extent of past and currently pending permit cases (e.g., CUPs, yard modifications, plot plan reviews, environmental assessments, etc). These cases were drawn from the legacy CTRACK database, and are updated on a monthly basis from the currently active KIVA database. Cases mined from both databases reflect the wide range of land use issues addressed and administered by the LA County Dept of Regional Planning, both past and present. Most cases are parcel-based, although some pertain to subdivisions or other planning boundaries. Note that Notices of Violation (pertaining to Subdivision Map Act Section 66499.36) file numbers are also featured in this layer.","crimes, crimes, report, cities, case, postal"
Land Use Policy - 1980 General Plan (Unincorporated Areas),2,"Referred to as the “General Plan” and encompasses the unincorporated areas (sometimes referred to as ‘islands’) NOT COVERED by a community, neighborhood or area plan.  Adopted by the Board of Supervisors on November 25, 1980.  Last Updated 10/29/14 for a small annexation to the city of Covina.
For more information on the County’s General Plan go to:  http://planning.lacounty.gov/generalplan
Legends for this plan can be found as the first entry on this page::  http://planning.lacounty.gov/view/gis-net3_help_-_land_use_policy/#8



https://egis3.lacounty.gov/arcgis/rest/services/DRP/Open_Data/MapServer/7","plans, used, areas, zones, santa, airport"
Land Use Policy - Community/Area Plan (Unincorporated Areas),2,"This data depicts generalized land use classifications, each of which is intended to describe the dominant use characteristics within the area covered.  Updated information regarding public parks, school sites, freeways, rail/transit lines, and other ownership-specific boundaries have been incorporated into this data.  The actual use and intensity of development that may be allowed on private property within any given land classification is determined by a review of policy maps, other mapped and written policies of the General Plan, and the underlying zoning classification.  Updated 12/31/14 for the update to the East Los Angeles Community Plan and an annexation to the City of Santa Clarita.
Unincorporated areas included:
•	Altadena Community Plan
•	Antelope Valley Area Plan
•	East Los Angeles Community Plan
•	Hacienda Heights Community Plan
•	Marina Del Rey Land Use Plan (also listed under Specific Plans)
•	Rowland Heights Community General Plan
•	Santa Catalina Island Land Use Plan (also listed under Specific Plans)
•	Santa Clarita Valley Area Plan
•	Santa Monica Mountains Coastal Zone
•	Santa Monica Mountains North Area Plan
•	West Athens / Westmont Community Plan
•	Walnut Park Neighborhood Plan
Legends for each plan can be found here:  http://planning.lacounty.gov/view/gis-net3_help_-_land_use_policy/#8


https://egis3.lacounty.gov/arcgis/rest/services/DRP/Open_Data/MapServer/6","plans, used, areas, zones, santa, airport"
Specific Plans (Unincorporated Areas),2,"A Specific Plan implements the General Plan/Community Plan and is a more detailed version of the General Plan for a focused area.  The Specific Plan articulates planning considerations and imposes regulations or controls.
•	3rd Street Specific Plan - located in the community of East Los Angeles, adopted by the Board of Supervisors 11/12/14.  More info here:  http://planning.lacounty.gov/ela
•	La Vina - located in the community of Altadena, adopted by the Board of Supervisors – 12/26/89.  More info here:  http://planning.lacounty.gov/view/la_vina_specific_plan/
•	Newhall Ranch - a large planned community in Santa Clarita Valley, adopted by the Board of Supervisors – 12/27/03.  More info here:  http://planning.lacounty.gov/view/newhall_ranch_specific_plan/
•	Northlake- located in the Santa Clarita Valley, adopted by the Board of Supervisors – 6/1/92.  More info here:  http://planning.lacounty.gov/view/northlake_specific_plan/
•	Santa Catalina Island - no Specific Plan land use categories here – boundary only. Implements the Land Use Plan.  Adopted 11/28/89.  More info here:  http://planning.lacounty.gov/assets/upl/data/pd_santa-catalina-island-implementation.pdf
•	Universal City - adopted by the Board of Supervisors – 4/30/13.  More info here:  http://planning.lacounty.gov/view/nbcuniversal_evolution_plan_universal_studios_specific_plan_ordinance_speci/
*NOTE:  Marina del Rey is a specific plan - but not included in this layer.  It is provided separately.

Legends for each plan can be found at the bottom of this page:  http://planning.lacounty.gov/view/gis-net3_help_-_land_use_policy/#8
Maps of these can be found at the bottom of this page:
http://planning.lacounty.gov/gis/maps","plans, used, areas, zones, santa, airport"
Marina del Rey Land Use Plan (Specific Plan),2,"Marina Del Rey Land Use Plan adopted by the Board of Supervisors on March 20, 2012 and certified by the California Coastal Commission on February 8, 2012. (LCP Update).","plans, used, areas, zones, santa, airport"
Significant Ecological Area ( SEA),2,"Significant Ecological Areas (SEA) Significant Ecological Area (SEA) means an area that is determined to possess an example of biotic resources that cumulatively represent biological diversity for the purposes of protecting biotic diversity, as part of the Los Angeles County general plan or the city’s general plan. Additional regulations shall be applied based on County Code 22.56.215: Hillside management and significant ecological areas — Additional regulations.More information about the County’s SEA Program can be found at:  http://planning.lacounty.gov/sea/","plans, used, areas, zones, santa, airport"
Transit Oriented District - TOD (Unincorporated Areas),1,"Transit oriented districts are established as supplemental districts in order to promote transit-oriented and pedestrian-oriented development, to increase transit use, to manage traffic congestion, and to improve air quality.  For unincorporaed areas only.  

For detailed TOD development standards, please refer to County Code 22.44.420 ~ 22.44.450.Commission.","lights, districts, traffic, maintaining, los, angeles"
Rural Outdoor Lighting District - Dark Skies (Unincorporated Areas),1,"This project is an amendment to Title 22 of the County Code, Planning and Zoning, to establish a Rural Outdoor Lighting District for areas of unincorporated Los Angeles County. The proposed Ordinance will establish the District with regulations that will conserve energy and resources and promote dark skies for the enjoyment and health of humans and wildlife, while permitting reasonable uses of outdoor lighting for nighttime safety and security. The regulations include limitations on allowable light trespass, fully shielding outdoor lighting, and imposes maximum heights of fixtures. The draft ordinance includes requirements for street lighting in rural areas, outdoor recreation facilities and signs. The draft map depicts areas located within the proposed District.

For more information contact the Ordinance Studies Section or go to Rural Outdoor Lighting District Ordinance at http://planning.lacounty.gov/view/rural_outdoor_lighting_district_ordinance/.  For more information about adopted plans (including a complete list) go to:  http://planning.lacounty.gov/plans/adopted.  

UPDATED on 10/29/14 to remove from Santa Monica Mountains Coastal Zone following certification of plan by Coastal Commission.","lights, districts, traffic, maintaining, los, angeles"
Equestrian District - EQD (Unincorporated Areas),1,"The equestrian district is established as a supplemental district in order to recognize particular areas where the keeping or maintaining of horses and other large domestic animals for the personal use of members of the family residing on the premises has become or is intended to become an integral part of the character of the area.  This is within unincorporated areas of Los Angeles County only.  For detailed development standards for each Equestrian District, please refer to County Code 22.44 Part 3.","lights, districts, traffic, maintaining, los, angeles"
Zoned District - ZD (Unincorporated Areas),2,"These districts were established when zoning was created for Los Angeles County many years ago. It was a way to break the county up into distinct areas, smaller units, for easier record keeping and organization. It is still in use to identify and keep track of those ordinances and for running queries against permits and ordinances in the LA County Department of Regional Planning.  For a list of zoned districts or for other information on these districts, please refer to County Code 22.16 Zoned Districts and Maps.  Updated 12/31/14 for an annexation to city of Covina.","plans, used, areas, zones, santa, airport"
Airport Influence Area,2,"An airport influence area is the area which current or future airport-related noise, over flight, safety, and/or airspace protection factors may significantly affect land uses or necessitate restrictions on those uses. It includes airport owned property, Runway Protection Zones (RPZ), inner & outer safety zones and Community Noise Equivalent Level (CNEL) contours.

Airports within the County are under the jurisdiction of the Airport Land Use Commission (ALUC). The ALUC is required to prepare and adopt a Comprehensive Land Use Plan (CLUP), review and make recommendations concerning certain projects within the ALUC planning boundaries, and review and make recommendations on regulations of local agencies. Though given the authority to review and make recommendations, the ALUC does not have jurisdiction over airport operations.


State Law requires the creation of Airport Land Use Commissions (ALUCs) to coordinate planning for the areas surrounding public use airports. In Los Angeles County the Regional Planning Commission has the responsibility for acting as the Airport Land Use Commission (ALUC) and for coordinating the airport planning of public agencies within the county.","plans, used, areas, zones, santa, airport"
Community Standards District (CSD) Subareas (Unincorporated Areas),2,"The community standards districts are established as supplemental districts to provide a means of implementing special development standards contained in adopted neighborhood, community, area, specific and local coastal plans within the unincorporated areas of Los Angeles County, or to provide a means of addressing special problems which are unique to certain geographic areas within the unincorporated areas of Los Angeles County. These are the boundaries for the 'Area Specific Standards' within CSDs. Examples include Union Pacific in East Los Angeles and Lake Avenue in Altadena.","plans, used, areas, zones, santa, airport"
Community Standards District - CSD (Unincorporated Areas),2,"The community standards districts (CSDs) are established as supplemental districts to provide a means of implementing special development standards contained in adopted neighborhood, community, area, specific and local coastal plans within the UNINCORPORATED areas of Los Angeles County, or to provide a means of addressing special problems which are unique to certain geographic areas within the unincorporated areas of Los Angeles County. For detailed development standards for each CSD, please refer to County Code 22.44 Part 2.  Last Updated 10/29/14 – Update of CSDs in Santa Monica Mountains to reflect the change of the Official Coastal Zone Boundary.","plans, used, areas, zones, santa, airport"
Zoning - Santa Catalina Island (Land Use Districts),2,"This is a seperate zoning layer from the rest of the county as it has different categories.  Santa Catalina Island falls under a specific plan (22.46.050 et.al.), which designates land use districts for the unincorporated area of the island.  These land use districts serve the same role as zones, but supersede the basic zones in Title 22.  This has been in effect as of the adoption of the Santa Catalina Island Specific Plan in 1989.","plans, used, areas, zones, santa, airport"
Agricultural Opportunity Area,2,"This identifies areas that are presently or historically used for agricultural purposes. This information was digitized from the 1986 Antelope Valley Hazards and Resources map, and the 1980 General Plan Special Management Areas map. Source: Antelope Valley Area Plan (1986), General Plan Special Management Areas (1980).","plans, used, areas, zones, santa, airport"
Town Council Area (Unincorporated Areas),6,A town council is a democratically elected form of government for small municipalities or civil parishes in unincorporated areas of Los Angeles County.  A council may serve as both the representative and executive branch. Source: individual town councils and the GIS Section; last update: January 2015.,"los, angeles, los, basins, water, angeles"
Terms of Use,2,This is the Terms of Use for using this site,"plans, used, areas, zones, santa, airport"
Zoning (Unincorporated Areas),2,"This is zoning for the unincorporated areas of Los Angeles County.

For more complete information, see Title 22 (Planning and Zoning) of the Los Angeles County Code, or stop by the office of the Los Angeles County Department of Regional Planning, Room 1360 Hall of Records, 320 W. Temple St., Los Angeles, CA 90012. Phone: (213) 974-6411. (Note: Citations which follow refer to sections within the Zoning Ordinance).  LAST UPDATED 12/31/14 for zone changes in South Whittier, East Los Angeles, and an annexation in Santa Clarita Valley.  PLEASE NOTE, Santa Catalina Island is not included in this dataset.  It is in a separate data layer since Catalina has specific zoning categories that differ from the Countywide zoning categories found in Title 22.","plans, used, areas, zones, santa, airport"
Locations/Points of Interest (LMS Data),9,"This dataset comes from the County’s Location Management System (LMS), which is a collaborative system to locations across the County.  The full dataset contains over 73,000 locations, including 63,000 public (available for download below) and14,000 non-public locations (available for government entities only) with consistent attributes.   Location types are broken into more than 270 unique types using three categories (cat1, cat2, cat3) that provide detailed breakdowns of the location types.

Click for more information:
http://egis3.lacounty.gov/dataportal/2014/07/07/locationspoints-of-interest-lms-data/","type, data, set, summary, located, data"
Airports - Los Angeles County,2,"Shows airports in Los Angeles County.  For a link to the Department of Regional Planning’s Airport Land Use Commission page, go to:  http://planning.lacounty.gov/aluc

From this data service:  https://egis3.lacounty.gov/arcgis/rest/services/DRP/Open_Data/MapServer/0","plans, used, areas, zones, santa, airport"
LA County City Boundaries,1,"City boundaries in Los Angeles county. 

https://egis3.lacounty.gov/arcgis/rest/services/LACounty_Dynamic/Political_Boundaries/MapServer/19

You can download a shapefile of these boundaries from the LA County Data Portal located here: http://egis3.lacounty.gov/dataportal/2013/06/11/city-annexations/","lights, districts, traffic, maintaining, los, angeles"
Planning Permits and Case Information for Unincorporated Areas,3,"This layer shows the spatial extent of past and currently pending permit cases (e.g., CUPs, yard modifications, plot plan reviews, environmental assessments, etc). These cases were drawn from the legacy CTRACK database, and are updated on a monthly basis from the currently active KIVA database. Cases mined from both databases reflect the wide range of land use issues addressed and administered by the LA County Dept of Regional Planning, both past and present. Most cases are parcel-based, although some pertain to subdivisions or other planning boundaries. Note that Notices of Violation (pertaining to Subdivision Map Act Section 66499.36) file numbers are also featured in this layer.","crimes, crimes, report, cities, case, postal"
Subdivision Activity (Unincorporated Areas),8,"This layer (Subdivision Activity) represents land subdivisions in the unincorporated area that are recorded, approved, or pending in the subdivision process.   These are Tract Maps (TR) and Parcel Maps (PM).","subdivision, statistics, record, approved, proposed, maps"
Traffic Count  Data,4,"The County of Los Angeles conducts over 1600 vehicular traffic volume counts per year. The data is a compilation of Average Daily Traffic (ADT) gathered largely from the unincorporated areas of the County of Los Angeles. The data includes the location, count date, 24-hour ADT, AM Peak, and PM Peak.","data, la, la, year, unincorporated, areas"
Construction Projects Bid Price History,6,Historical pricing for items of work performed on low-bid construction projects,"los, angeles, los, basins, water, angeles"
LA County Mile Markers,1,"Mile markers are generally located along the road side edge where a culvert passes under the road. The Malibu area, Road Maintenance District 336 and 339, the mile marker positions were located at the inlet and outlet of the drainage asset, so they may not be right along the road's edge. Remaining mile marker positions throughout the County were located by a vehicle mounted receiver/antenna stopping near the mile marker within less than 5 feet of the marker post. Expected accuracy of all positions is less than one meter, but data position is not exactly at the marker post. With few exeception in Districts 336 and 339, most positions are within 10 to 20 feet of the actual marker post and along the road side edge.","lights, districts, traffic, maintaining, los, angeles"
Census Blocks 2010,4,2010 Census Blocks clipped to the County Boundary. A new field “COMMNAME” was added and populated with city and community names based on 2011 redistricting unit community names in the census block data.,"data, la, la, year, unincorporated, areas"
Census Tracts 2010,4,2010 Census Tracts clipped to the County Boundary. Two new fields were added to this census tract data – area in square feet and area in square miles.,"data, la, la, year, unincorporated, areas"
Supervisorial Districts 2011,1,Boundaries of Los Angeles County Supervisorial Districts from 2011 (created by the LA County Dept. of Public Works).,"lights, districts, traffic, maintaining, los, angeles"
City and Community Boundaries,8,Board Approved Statistical Areas for reporting statistics Countywide,"subdivision, statistics, record, approved, proposed, maps"
City Boundaries,4,"City boundaries managed by the LA County Dept. of Public Works.  Unincorporated areas are not distinguished by name, other than labeled unincorporated.","data, la, la, year, unincorporated, areas"
LA County GIS Data Portal,4,"The County’s Enterprise GIS Steering Committee has established this site is to make high quality geographic information simple and easy to find, while providing a forum for feedback, questions, and discussion about particular data.  This site was created before the new Socrata Open Data platform was introduced.

Los Angeles County will make as much GIS data as it can, available for public use (i.e. FREE).  In some cases, due to licensing restrictions, privacy concerns, or outside ownership, we are unable to do so.  However, we will provide information about all of our data holdings, since there may be ways to access the data if you partner with the County.","data, la, la, year, unincorporated, areas"
ZIP Codes,6,"ZIP Codes in Los Angeles County.

ZIP codes are a system of postal codes used by the United States Postal Service (USPS) since 1963.  Provided here because many tables and other datasets have ZIP code information within them.  Managed by the USPS but provided for reference purposes.","los, angeles, los, basins, water, angeles"
